{
  "$schema": "https://json-schema.org/draft/2020-12/schema",
  "type": "object",
  "additionalProperties": false,
  "required": [
    "schema",
    "scale",
    "core_values",
    "formulas",
    "sharingan_hardware",
    "sharingan_features",
    "byakugan_features",
    "native_rule",
    "transplant_rule",
    "copy_rule",
    "passive_drain_zero_rule",
    "activation_margin_bands",
    "hardware_progression",
    "prediction_limit",
    "blind_spot_rule"
  ],
  "properties": {
    "schema": {
      "const": "dojutsu-mechanics"
    },
    "scale": {
      "type": "string"
    },
    "core_values": {
      "type": "array"
    },
    "formulas": {
      "type": "object"
    },
    "sharingan_hardware": {
      "type": "object"
    },
    "sharingan_features": {
      "type": "array"
    },
    "byakugan_features": {
      "type": "array"
    },
    "native_rule": {
      "type": "string"
    },
    "transplant_rule": {
      "type": "string"
    },
    "copy_rule": {
      "type": "string"
    },
    "passive_drain_zero_rule": {
      "type": "string"
    },
    "activation_margin_bands": {
      "type": "object"
    },
    "hardware_progression": {
      "type": "object"
    },
    "prediction_limit": {
      "type": "string"
    },
    "blind_spot_rule": {
      "type": "string"
    }
  }
}
